{
  "$schema": "https://json-schema.org/draft/2020-12/schema",
  "$id": "https://lattice.dev/schemas/stat.schema.json",
  "title": "StatDef",
  "description": "A stat declared in data (plan/02 \u00A71). The Key is the identifier formulas use (Str, HP); the def id (stat_str) is what other defs reference. Convention: IDs in structural fields, keys in formula strings.",
  "type": "object",
  "properties": {
    "id": {
      "type": "string",
      "description": "Globally unique def ID."
    },
    "type": {
      "const": "stat"
    },
    "description": {
      "type": "string",
      "description": "One line for humans and LLMs (surfaced by the manifest)."
    },
    "inherits": {
      "type": "string",
      "description": "Parent def ID (same kind); objects deep-merge, scalars override, arrays replace or take {\u0022$append\u0022/\u0022$remove\u0022} patches.",
      "x-lattice-ref": "stat"
    },
    "key": {
      "type": "string"
    },
    "name": {
      "type": "string"
    },
    "min": {
      "type": "string"
    },
    "max": {
      "type": "string"
    },
    "default": {
      "type": "string"
    },
    "formula": {
      "type": "string"
    },
    "vital": {
      "type": "boolean"
    }
  },
  "required": [
    "id",
    "type"
  ]
}